{
  "schema_version": "1.0.0",
  "id": "id-example-0001",
  "created_at": "2026-07-26T12:00:00Z",
  "correlation_id": "correlation_id-example-0001",
  "trace_id": "trace_id-example-0001",
  "run_id": "run_id-example-0001",
  "step_id": "step_id-example-0001",
  "tool_name": "example-tool-name-00",
  "tool_version": "1.0.0",
  "arguments": {},
  "arguments_digest": "sha256:aaaaaaaaaaaaaaaaaaaaaaaaaaaaaaaaaaaaaaaaaaaaaaaaaaaaaaaaaaaaaaaa",
  "risk_tier": "R0",
  "policy_context_id": "policy_context_id-example-0001",
  "deadline": "2026-07-26T12:00:00Z",
  "idempotency_key": "idempotency_key-example-0001"
}
